key	text	tooltip
diplomacy_strings_string_rome_christian_beg_hand_over_region_02	Імператор впевнений, що під рукою могутнього Риму ці землі розквітнуть, як ніколи раніше.	true
diplomacy_strings_string_personality_desc_long_tolerant_religiously	Цій людині неважливо, у що ти віриш. Її цікавить тільки чесність.	true
diplomacy_strings_string_barb_hun_generic_reject_respectful_02	Я змушений відхилити твою пропозицію, хоча вона здається вигідною, і чекати чогось кращого.	true
diplomacy_strings_string_barb_hun_generic_reject_respectful_03	Про честь твого народу ходять легенди, але я не можу прийняти твої умови.	true
diplomacy_strings_string_barb_hun_generic_reject_respectful_01	Предки цього не схвалять. Я не смію порушувати їхню волю.	true
diplomacy_strings_string_barb_hun_generic_reject_respectful_06	Як би не вабив мене запах з бенкетної зали, я не можу погодитися.	true
diplomacy_strings_string_barb_hun_generic_reject_respectful_07	Такі умови не підходять. Ви благородні люди, але мій народ нічого не виграє.	true
diplomacy_strings_string_personality_desc_long_intolerant_culturally	Він любить своїх родичів і намагається в усьому їм допомагати. Однак з чужинцями він не такий добрий.	true
diplomacy_strings_string_barb_hun_generic_reject_respectful_04	Ти говориш мудрі слова, але пропонуєш нікчемні речі. Я не можу погодитися.	true
diplomacy_strings_string_barb_hun_generic_reject_respectful_05	Я боюся, що згодою ображу душі предків. Але треба сказати, що твоя пропозиція великодушна.	true
diplomacy_strings_string_barb_hun_generic_reject_respectful_08	Боги розгніваються, якщо я так легко погоджуся. Але язиком трясти ти майстер!	true
diplomacy_strings_string_barb_hun_generic_reject_respectful_09	Начебто, ти говориш правду. Так що я відмовлюся з великим небажанням і без злого умислу.	true
diplomacy_strings_string_eastern_not_interested_in_further_discussion_06	Ми говорили і говорили, але тепер мої вуха здіймають дамбу на шляху твоїх слів.	true
diplomacy_strings_string_eastern_not_interested_in_further_discussion_05	Мій пан не терпить, коли його слуги витрачають час на нескінченні розмови. Прощавай!	true
diplomacy_strings_string_eastern_not_interested_in_further_discussion_04	Плітки і порожня балаканина хороші для старих жінок біля криниці, але на мене чекають більш важливі справи!	true
diplomacy_strings_string_eastern_not_interested_in_further_discussion_03	Ми билися над цим питанням, як викинуті на берег риби, але не знайшли шляху до моря згоди.	true
diplomacy_strings_string_personality_desc_short_opportunist	Опортуніст	true
diplomacy_strings_string_eastern_not_interested_in_further_discussion_02	Я більше не можу це слухати! Сонце вже сіло. Душа просить вина і жінок, а не заплутаних слів!	true
diplomacy_strings_string_eastern_not_interested_in_further_discussion_01	Досить! Мене втомила твоя балаканина. Вино виходить з чаші, та й було воно не з найкращих.	true
diplomacy_strings_string_rome_christian_offer_hand_over_region_01	Імператор вважає, що ти будеш гідним правителем цих земель, якщо приймеш їх у володіння.	true
diplomacy_strings_string_rome_christian_offer_hand_over_region_03	Імператор вважає, що під твоєю рукою ці землі будуть процвітати.	true
diplomacy_strings_string_rome_christian_offer_hand_over_region_02	Найвищий Імператор вважав за правильне передати ці землі тобі, щоб твій народ правив ними на свій розсуд.	true
diplomacy_strings_string_barb_hun_attack_faction_offer_02	Наші воїни, і старі, і молоді, рвуться в бій! Скажи лише слово - і ми виступимо проти цього народу!	true
diplomacy_strings_string_barb_hun_attack_faction_offer_03	Ми хочемо віддати чужинців на смерть, а їхні землі - вогню і мечу! Що скажеш ти?	true
diplomacy_strings_string_barb_hun_attack_faction_offer_01	Мої воїни жадають битви, крові і слави! Давай же разом нападемо на цих ледачих дурнів!	true
diplomacy_strings_string_eastern_acknowledge_get_military_off_my_land_02	Наше військо піде. Але, клянуся небом, втративши його велич, ви збіднієте.	true
diplomacy_strings_string_rome_request_angry_get_military_off_my_land_03	Твоє крихітне військо, як настирливий комар, доводить сенаторів до сказу. Забери своїх людей!	true
diplomacy_strings_string_eastern_acknowledge_get_military_off_my_land_03	Твоє бажання здійсниться. Мій повелитель негайно накаже відступити.	true
diplomacy_strings_string_rome_request_angry_get_military_off_my_land_02	Ти випробовуєш терпіння римлян, і скоро воно лусне! Негайно виведи свої огидні війська з наших земель!	true
diplomacy_strings_string_rome_request_angry_get_military_off_my_land_01	Очисти нашу землю! Відкликай військо і більше не повертайся. Така воля сенату і народу Риму.	true
diplomacy_strings_string_eastern_acknowledge_get_military_off_my_land_01	Що ж, мої воїни підуть, якщо така твоя воля. А мені ж здавалося, вони допомагають твоїм лобурям!	true
diplomacy_strings_string_rome_christian_reject_angry_hand_over_region_01	Тільки за те, що я вислухав таку пропозицію, Імператор скинув би мене з Тарпейської скелі. І тебе заодно.	true
diplomacy_strings_string_diplomatic_option_payment_tooltip	Запропонувати або вимагати гроші. Золото робить ваші аргументи більш вагомими. Передайте іншій державі золото і не вимагайте нічого натомість, і це істотно поліпшить ваші дипломатичні відносини.	true
diplomacy_strings_string_personality_desc_short_tolerant_culturally	Терпимий до чужих культур	true
diplomacy_strings_string_rome_christian_generic_reject_10	Скажу відразу: перед нашою зустріччю я бачив погані знамення. Схоже, сам Господь проти нашого союзу.	true
diplomacy_strings_string_eastern_offer_regular_payment_02	На наших землях виявилися незліченні скарби, і ми вирішили поділитися вдалою знахідкою з друзями.	true
diplomacy_strings_string_eastern_offer_regular_payment_03	Мій пан завжди говорив, що про друзів потрібно дбати. Він зауважив, що в твоїй скарбниці замало золота...	true
diplomacy_strings_string_eastern_offer_regular_payment_01	Дозволь мені маленький жарт: сподіваюся, твій скарбник не втомиться рахувати гроші!	true
diplomacy_strings_string_cha_personality_desc_short_greedy	Жадібний	true
diplomacy_strings_string_rome_christian_greek_beg_third_party_attack_02	Ти славишся своєю мудрістю, а війна з цим народом до вподоби самому Господу.	true
diplomacy_strings_string_rome_christian_greek_beg_third_party_attack_01	Благаю тебе, підніми свій меч на цих нечестивців! Наші народи їм однаково ненависні!	true
diplomacy_strings_string_rome_christian_greek_war_declaration_06	Ми оголошуємо війну! Нехай покарає тебе Господь! Нехай обрушиться Його гнів на весь твій рід до сьомого коліна!	true
diplomacy_strings_string_rome_christian_greek_war_declaration_07	Я піднесу молитви Господу, щоб він дарував нам швидку перемогу... хоча мені і хочеться продовжити твої муки!	true
diplomacy_strings_string_rome_christian_greek_war_declaration_01	Війна! Кінець бабиному миролюбству! Ми щасливі, бо Господь на нашому боці!	true
diplomacy_strings_string_rome_christian_greek_war_declaration_03	Всі ми створені з пороху - і порохом станете! А щоб прискорити справу, ми спалимо ваші міста...	true
diplomacy_strings_string_eastern_reject_offer_regular_payment_01	Мій друже, наші скрині вщерть повні багатств — навіщо нам ще більше?!	true
diplomacy_strings_string_eastern_reject_offer_regular_payment_02	Твої наміри чесні, але я не можу прийняти це золото, не ставши твоїм боржником.	true
diplomacy_strings_string_eastern_reject_offer_regular_payment_03	Твій жест великодушний, але мій народ не потребує твоїх подачок.	true
diplomacy_strings_string_rome_christian_greek_offer_beg_peace_01	З усією смиренністю і покладаючись на волю Божу, я прошу тебе припинити страждання мого народу і цю війну.	true
diplomacy_strings_string_rome_christian_greek_offer_beg_peace_02	Господи, вклади в мої уста слова переконання! Нам пора укласти мир!	true
diplomacy_strings_string_rome_christian_greek_offer_beg_peace_06	Не заради себе, але заради свого народу я прошу миру, бо Ісус сказав: «Блаженні миротворці».	true
diplomacy_strings_string_rome_christian_greek_offer_beg_trade_01	Господь благословить тебе, якщо ти узакониш торговельні зв'язки між нашими народами. Не гнівай Його!	true
diplomacy_strings_string_rome_christian_generic_reject_09	Ха-ха! Імператора б розсмішила така пропозиція, тому я теж сміюся!	true
diplomacy_strings_string_diplomatic_option_defensive_alliance_tooltip	Якщо одному учаснику оборонного союзу оголосять війну, інший зобов'язаний прийти йому на допомогу. Для укладення військового союзу вас і вашого партнера повинні пов'язувати дружні стосунки.	true
diplomacy_strings_string_rome_christian_generic_reject_05	Не думаю, що Імператор схвалить такий стан речей. Вважай це відмовою.	true
diplomacy_strings_string_rome_christian_generic_reject_04	Я навіть не буду турбувати Імператора. Твоя пропозиція нам не підходить, і ми відхиляємо її.	true
diplomacy_strings_string_rome_christian_generic_reject_03	Ні, ні і ще раз ні! Я навіть не буду турбувати Імператора з цього питання.	true
diplomacy_strings_string_rome_christian_generic_reject_02	Не сумніваюся, що ти майстер говорити красиві промови, але мене так просто не обдуриш!	true
diplomacy_strings_string_barb_hun_receive_requesting_10	Тобто ти мені наговориш усіляких люб’язностей, а мені доведеться це вислуховувати?	true
diplomacy_strings_string_rome_christian_greek_offer_regular_payment_02	Господь посміхається тим, хто робить добрі вчинки. Тому ми пропонуємо вам ці гроші...	true
diplomacy_strings_string_eastern_reject_angry_defend_against_faction_01	Ні! Клянуся священним полум'ям: ні! Жоден меч не покине піхов заради такої нікчемної і марної затії!	true
diplomacy_strings_string_eastern_reject_angry_defend_against_faction_03	Невже ви - діти, які ховаються за дорослими при першій небезпеці? Тьху!	true
diplomacy_strings_string_eastern_reject_angry_defend_against_faction_02	Божевільні, ви самі поклали голову в пащу лева. І ми не завадимо йому вкусити.	true
diplomacy_strings_string_barb_hun_receive_requesting_03	Моєму народу і моїм предкам до вподоби чесні слова і чіткі цілі.	true
diplomacy_strings_string_barb_hun_receive_requesting_02	Любов'ю чи гнівом відгукнуться твої слова в моєму серці, залежить тільки від тебе.	true
diplomacy_strings_string_barb_hun_receive_requesting_01	Говори прямо. Ми чесний народ і чекаємо чесності від інших.	true
diplomacy_strings_string_rome_christian_greek_reject_angry_offer_demand_peace_04	Так, значить, ти просиш про милосердя... Але ви пробудили лють в наших душах і заслужили розплати!	true
diplomacy_strings_string_barb_hun_receive_requesting_07	Ми обговоримо все, що ти побажаєш. Сподіваюся, твої слова мене не розчарують.	true
diplomacy_strings_string_barb_hun_receive_requesting_06	Говори прямо і по справі - і все буде добре.	true
diplomacy_strings_string_barb_hun_receive_requesting_05	Мені не потрібна порожня балаканина без мудрості.	true
diplomacy_strings_string_barb_hun_receive_requesting_04	Ми з радістю вислухаємо тебе, але не намагайся брехати!	true
diplomacy_strings_string_barb_hun_receive_requesting_09	Боги велять мені вислухати твою промову, але прошу - говори по суті!	true
diplomacy_strings_string_barb_hun_receive_requesting_08	Твій народ знає, що таке честь. Я вислухаю тебе.	true
diplomacy_strings_string_diplomatic_factor_positive	Вони схвалюють...	true
diplomacy_strings_string_rome_christian_demand_single_payment_03	Ми не претендуємо на твої багатства, проте друзі повинні ділитися один з одним. Щедрість до вподоби Господу!	true
diplomacy_strings_string_rome_demand_regular_payment_02	Розумно поводиться той, хто робить внески в нашу скарбницю, щоб захистити себе від майбутніх напастей.	true
diplomacy_strings_string_rome_demand_regular_payment_03	Ох, соромно бути таким багатим! Але ми розуміємо твоє збентеження й готові позбавити тебе і сорому, і зайвих монет.	true
diplomacy_strings_string_rome_demand_regular_payment_01	Тебе обтяжує велика сума, яка більше знадобилася б у нашій скарбниці.	true
diplomacy_strings_string_rome_christian_greek_request_defend_against_faction_03	В ім'я Імператора, прошу тебе: допоможи нам відбитися від цих лютих псів! Коли ти надішлеш підкріплення?	true
diplomacy_strings_string_rome_christian_acknowledge_accept_state_gift_03	Ми приймаємо твій дар з вдячністю.	true
diplomacy_strings_string_barbarian_approach_demanding_03	Я тут і сповнений завзятістю кульгавого віслюка, що везе непідйомні тюки. Скажу я ось що...	true
diplomacy_strings_string_barbarian_approach_demanding_02	Я прийшов поговорити з тобою. Тьху! Скільки ж богів на мене розлютилося, якщо мені довірили цю бабину роботу?	true
diplomacy_strings_string_barbarian_approach_demanding_01	Я посланий говорити з тобою і слухати тебе. Мабуть, я прогнівав богів, якщо така їхня воля.	true
diplomacy_strings_string_barbarian_approach_demanding_07	Мені було б приємніше вести справи з демонами, відьмами і гарпіями, ніж з тобою, - але така моя доля!	true
diplomacy_strings_string_barbarian_approach_demanding_06	Говорити з тобою - справжнє катування. Не змушуй мене даремно витрачати слова!	true
diplomacy_strings_string_barbarian_approach_demanding_05	Після нашої бесіди я збираюся осушити діжечку доброго елю, так що говоритиму коротко і зрозуміло.	true
diplomacy_strings_string_rome_christian_greek_reject_offer_demand_cooperation_04	Ні. Вчора здригнулася земля: це Небеса попереджали нас про страшну небезпеку...	true
diplomacy_strings_string_barbarian_approach_demanding_04	Я охочіше набив би черево жирним окороком, ніж базікав би з тобою... Але діватися нікуди!	true
diplomacy_strings_string_barbarian_approach_demanding_09	Доброти і терпіння в мені мало, тож слухай і не перебивай. А потім скажи «так»!	true
diplomacy_strings_string_barbarian_approach_demanding_08	Мої співвітчизники не хотіли йти сюди замість мене... Почувши твій запах, я розумію, чому.	true
diplomacy_strings_string_barb_hun_offer_single_payment_01	Ось, візьми ці крихти. Нехай вони відвернуть тебе від нашого порога - шукай здобичі в інших угіддях.	true
diplomacy_strings_string_barb_hun_offer_single_payment_03	Мій народ підносить тобі в дар це золото... якщо ти його приймеш.	true
diplomacy_strings_string_barb_hun_offer_single_payment_02	Предки кажуть, що ми повинні обдарувати вас золотом. Хто ми, щоб сперечатися з ними?	true
diplomacy_strings_string_current_treaty_defensive_alliance	Оборонний союз||Сторони клянуться, що, якщо одному учаснику союзу оголосять війну, інший прийде на допомогу.	true
diplomacy_strings_string_barb_hun_reject_offer_single_payment_02	Безперечно, сума гідна — але наші серця сповнені відваги, а не жадоби до золота.	true
diplomacy_strings_string_barb_hun_reject_offer_single_payment_03	Душі праотців будуть ображені, якщо ми приймемо хоч одну монету. Вони знали, що таке гордість...	true
diplomacy_strings_string_barb_hun_reject_offer_single_payment_01	У тебе серце торговця. Нам не потрібне твоє золото.	true
diplomacy_strings_string_eastern_request_state_gift_02	Мій володар звик отримувати дари, співмірні з його величчю. Сподіваюся, у тебе є гідний дарунок.	true
diplomacy_strings_string_eastern_request_state_gift_03	Чи є у тебе дарунки, щоб на ділі довести слова про дружбу?	true
diplomacy_strings_string_eastern_request_state_gift_01	Знай же! Простий дар вшанує і тебе - як дарувальника, - і мого пана.	true
diplomacy_strings_string_personality_desc_long_progressive	Цей чоловік не надає значення минулому. Про ваші діяння він теж забуває дуже швидко.	true
diplomacy_strings_string_barbarian_acknowledge_cancel_trade_03	Угода скасована. Ми залишимо товари собі — адже ми знаємо їхню справжню ціну!	true
diplomacy_strings_string_barbarian_acknowledge_cancel_trade_02	Воістину, в обміні дрібницями мало честі. Справжні чоловіки обмінюються ударами, нехай і в потішній сутичці!	true
diplomacy_strings_string_barbarian_acknowledge_cancel_trade_01	Наші купці знайдуть прибуток в інших краях і надалі не турбуватимуть тебе. Нехай твої купці вчинять так само.	true
diplomacy_strings_string_barbarian_approach_demanding_10	Сокира для мене звичніша за легковажні слова, тому краще зі мною не сперечатися.	true
diplomacy_strings_string_rome_christian_reject_angry_demand_military_access_02	Імператор швидше розділить ложе з царем Місячного народу, ніж погодиться на таку божевільну пропозицію!	true
diplomacy_strings_string_rome_christian_reject_angry_demand_military_access_01	Імператор ніколи не погодиться на те, щоб немиті чужинці розгулювали по його землях.	true
diplomacy_strings_string_personality_desc_long_intolerant_religiously	Цей чоловік переконаний, що його віра - єдино правильна. Він відмовляється мати справу з іновірцями.	true
diplomacy_strings_string_eastern_reject_defend_against_faction_01	Чудовий задум, однак, борючись поодинці, твій народ зможе здобути більше слави!	true
diplomacy_strings_string_eastern_reject_defend_against_faction_03	Тобі доведеться битися поодинці: наші війська існують швидше в книгах рахівників, ніж в дійсності.	true
diplomacy_strings_string_eastern_reject_defend_against_faction_02	Наші мечі затупилися, в наших військах не вистачає вмілих командирів. Ми не зможемо тобі допомогти.	true
diplomacy_strings_string_eastern_beg_military_access_01	Мій володар бажає провести війська через твої землі. Він не бажає тобі зла, а тому не чини йому перешкод.	true
diplomacy_strings_string_eastern_acknowledge_accept_10	Мені казали, що ти нудніший за впертого дромадера, але це виявилось чистісінькою вигадкою!	true
diplomacy_strings_string_eastern_acknowledge_reject_10	Ти не боїшся, що за такі слова боги нашлють на тебе виразку?	true
diplomacy_strings_string_eastern_beg_military_access_02	Шлях мого війська пролягає через твої землі. Воїни поводитимуться стримано і з повагою.	true
diplomacy_strings_string_eastern_beg_military_access_03	Нам треба провести військо через твої землі. Ти відповіси «так» на це скромне прохання?	true
diplomacy_strings_string_barbarian_request_get_military_off_my_land_02	Вашим воїнам відтепер не можна проходити через наші землі. Духи показали це абсолютно ясно.	true
