key	text	tooltip
diplomacy_strings_string_offer_or_demand_break_client_state	Зняти статус васала:	true
diplomacy_strings_string_offer_or_demand_break_non_aggression_pact	Розірвати договір про ненапад:	true
diplomacy_strings_string_barb_hun_generic_offer_demand_08	Ми не вміємо красномовно висловлюватися, як греки, але наші слова чесні і йдуть від серця.	true
diplomacy_strings_string_barb_hun_generic_offer_demand_09	Воїни за своєю природою схильні рубати з плеча, добираючись до самої суті. Вислухай мене уважно.	true
diplomacy_strings_string_barb_hun_generic_offer_demand_02	Я вкладаю меч у піхви, щоб поговорити з тобою, як воїн з воїном. Так влаштований світ - принаймні, для чоловіків.	true
diplomacy_strings_string_barb_hun_generic_offer_demand_03	Я говорю від імені всього народу. Нехай це стане знаком доброї волі!	true
diplomacy_strings_string_rome_christian_greek_request_get_military_off_my_land_01	Господь створив наші землі прекрасними не для того, щоб твої воїни насолоджувалися їх краєвидами. Виведи війська!	true
diplomacy_strings_string_barb_hun_generic_offer_demand_01	Пропоную поговорити по-чоловічому. Адже ми здатні відкласти зброю хоча б на час бесіди?	true
diplomacy_strings_string_barb_hun_generic_offer_demand_06	Нехай моя мова буде гострою як ніж і з такою ж легкістю дістанеться до суті. Слухай і погоджуйся...	true
diplomacy_strings_string_rome_beg_third_party_join_war_01	Невже тобі не вистачить духу відправитися на війну? Чудовиська, з якими ми воюємо, рано чи пізно дістануться і до твого народу!	true
diplomacy_strings_string_barb_hun_generic_offer_demand_07	Я тут не для того, щоб вимагати. О ні: у мене є пропозиція, гідна твого народу...	true
diplomacy_strings_string_barb_hun_generic_offer_demand_04	Я пропоную чесну угоду. Боги свідки: все буде так, як ми сьогодні вирішимо.	true
diplomacy_strings_string_rome_beg_third_party_join_war_03	У цій війні твій народ чекає слава і багата здобич! Виступайте разом з нами!	true
diplomacy_strings_string_barb_hun_generic_offer_demand_05	Запитай у духів предків, але і без їхніх порад легко зрозуміти: моя пропозиція вигідна.	true
diplomacy_strings_string_rome_beg_third_party_join_war_02	Ми вимагаємо, щоб твій народ послухався голосу честі і вступив у війну. Якщо ви глухі до поклику честі, подумайте про наживу!	true
diplomacy_strings_string_barbarian_reject_demand_vassal_status_02	Від такої пропозиції мої предки перевернуться в могилах! Моя відповідь - тверде «ні»!	true
diplomacy_strings_string_barbarian_reject_demand_vassal_status_03	Кому від цього стане краще? Ти кличеш у свій дім розбрат, жорстокість і повстання. Ми ж нічого не отримаємо.	true
diplomacy_strings_string_barbarian_reject_demand_vassal_status_01	Ні! Я б не довірив твоєму народові владарювати навіть над злодіями й шибениками.	true
diplomacy_strings_string_diplomacy_option_break_treaty_third_party_tooltip	Надішліть іншій фракції пропозицію або вимогу розірвати угоду з третьою стороною. Пам'ятайте: той, хто не любить цю «третю сторону», легше відмовиться від союзу з нею.	true
diplomacy_strings_string_eastern_beg_hand_over_region_01	Втішся тим, друже, що під рукою мого володаря ці землі будуть більш... прибутковими.	true
diplomacy_strings_string_eastern_beg_hand_over_region_03	Благаю, просто зрозумій: під владою мого володаря твій народ буде процвітати.	true
diplomacy_strings_string_eastern_beg_hand_over_region_02	Хіба тобі, людині досвідченій в державних справах, не очевидні переваги передачі цих земель в наші руки?	true
diplomacy_strings_string_diplomacy_option_break_treaty_third_party_on_table_tooltip_ai_side	Якщо переговори з фракцією пройдуть успішно, вона розірве існуючі договори з перерахованими сторонами.	true
diplomacy_strings_string_rome_christian_not_interested_in_further_discussion_04	Тим, хто служить Господу, доводиться бути терплячими - але твої слова вичерпали чашу мого терпіння! Досить!	true
diplomacy_strings_string_diplomatic_option_trade_agreement_warning	Розірвати торговельну угоду||Ви хочете розірвати торговельну угоду з цією фракцією?	true
diplomacy_strings_string_rome_christian_reject_demand_regular_payment_01	Імператор - не торговець, щоб платити мита чужинцям.	true
diplomacy_strings_string_diplomacy_personality_aggressiveness_tooltip	Агресивність ||Чим агресивніша фракція, тим більше у неї ворогів. Будьте обережні, заводячи агресивних союзників: з великою ймовірністю вони втягнуть вас у безліч воєн і конфліктів.	true
diplomacy_strings_string_personality_desc_short_tolerant_religiously	Терпимий до чужих релігій	true
diplomacy_strings_string_barb_hun_reject_angry_offer_single_payment_01	Радій, що я не засунув це золото тобі в горло!	true
diplomacy_strings_string_barb_hun_reject_angry_offer_single_payment_02	Нам не потрібні твої гроші. Витрать їх на храми для своїх фальшивих богів!	true
diplomacy_strings_string_barb_hun_reject_angry_offer_single_payment_03	Можливо, грошима ти завоюєш любов повій - але не мрій використовувати нас для збочених задоволень!	true
diplomacy_strings_string_eastern_reject_offer_single_payment_01	На жаль, твоя нечувана щедрість марна. Мого пана не можна купити, як верблюда на ринку.	true
diplomacy_strings_string_eastern_reject_offer_single_payment_02	Така щедрість робить честь твоєму народу. Але нам зовсім не потрібні твої дари!	true
diplomacy_strings_string_eastern_reject_offer_single_payment_03	Очі твої чесні, навіть коли ти пропонуєш хабар. І все ж я відмовлюся від твоєї пропозиції.	true
diplomacy_strings_string_player_reliability_very_low	Невірний	true
diplomacy_strings_string_barbarian_request_player_join_confederation_01	Приєднайся до своїх братів! Коли всі встануть під одним прапором, земля здригнеться від нашого кроку!	true
diplomacy_strings_string_barb_christian_offer_request_peace_01	Я слухав слово Господа нашого Ісуса Христа. Він говорить лише про мир...	true
diplomacy_strings_string_barbarian_request_player_join_confederation_03	Нехай наші народи стануть єдиною родиною! Разом ми здобудемо незрівнянну славу!	true
diplomacy_strings_string_rome_christian_defend_against_faction_offer_02	Якщо тобі потрібна допомога імперії - тільки скажи, і Імператор про все подбає.	true
diplomacy_strings_string_barbarian_request_player_join_confederation_02	Прийшов час пов'язати себе узами, міцнішими за дружні!	true
diplomacy_strings_string_barb_christian_offer_request_peace_04	Ця безглузда війна не до вподоби Господу. Укладемо мир?	true
diplomacy_strings_string_reliability_very_low	Підлий	true
diplomacy_strings_string_rome_christian_greek_approach_begging_04	Дякую за приділену увагу. Сподіваюся, Господь влаштує так, що наша зустріч пройде в злагоді.	true
diplomacy_strings_string_rome_christian_greek_approach_begging_07	Ти славишся мудрістю і прозорливістю. Христос благоволить тебе. Тому, прошу, приділи мені трохи уваги...	true
diplomacy_strings_string_rome_christian_greek_approach_begging_02	Вітаю. Ми невпинно підносимо молитви Христу, щоб він послав благоденство тобі і твоєму народу! А тепер до справи...	true
diplomacy_strings_string_barbarian_reject_angry_demand_regular_payment_03	Золота хочеш? У тебе немає честі, якщо ти просиш недоїдки зі столу! Геть з очей моїх!	true
diplomacy_strings_string_barbarian_reject_angry_demand_regular_payment_02	Ми не платимо вовкам за те, щоб вони не чіпали наші стада. Коли вони нахабніють, ми вирушаємо на полювання...	true
diplomacy_strings_string_barbarian_reject_angry_demand_regular_payment_01	Золото? Для тебе немає нічого ціннішого? Від нас ти отримаєш тільки презирство!	true
diplomacy_strings_string_eastern_reject_angry_offer_demand_peace_01	Отже, ти хочеш миру. Миру. Зараз. Боги, дайте мені сил відпустити цього вісника живим, щоб він зміг передати мою відмову!	true
diplomacy_strings_string_eastern_reject_angry_offer_demand_peace_03	У тебе жахливий акцент! На мить я подумав, що ти просиш миру. Ха-ха!	true
diplomacy_strings_string_eastern_reject_angry_offer_demand_peace_02	У нас неодмінно буде мир, але спершу ми насадимо вас усіх на палю!	true
diplomacy_strings_string_eastern_reject_angry_offer_demand_peace_05	Мир... Чи війна? Мабуть, ми будемо битися доти, доки ти не здохнеш як собака.	true
diplomacy_strings_string_eastern_reject_angry_offer_demand_trade_02	Кажуть, твої купці жадібні, брехливі і до того ж так і норовлять обважити. Навіщо ж з ними торгувати?	true
diplomacy_strings_string_eastern_reject_angry_offer_demand_peace_04	Ти просиш миру? Проси далі. Можеш поповзати переді мною на колінах. Тільки пам'ятай: миру не буде.	true
diplomacy_strings_string_eastern_reject_angry_offer_demand_trade_03	Ні! Наш народ віддасть хвалу богам за те, що ми не прийняли ваш смердючий мотлох!	true
diplomacy_strings_string_eastern_reject_angry_offer_demand_peace_06	Ти просиш миру? Проси хоч до молодика, хоч до кінця світу - я не припиню війни!	true
diplomacy_strings_string_eastern_reject_angry_offer_demand_trade_01	Мені здалося? Ти хочеш вести торгівлю з нашим народом? Мій народ не купує кінський гній.	true
diplomacy_strings_string_barbarian_reject_offer_regular_payment_03	Ми не батраки і не найманці, щоб задовольнятися крихтами в нагороду за слухняність.	true
diplomacy_strings_string_barbarian_reject_offer_regular_payment_02	Наші предки не жебракували і не прислужували. Ми не станемо бігати у тебе на побігеньках.	true
diplomacy_strings_string_barbarian_reject_offer_regular_payment_01	Не сумніваюся, для тебе гроші - чи не найголовніше. Нам же честь, благородство і слава набагато дорожчі!	true
diplomacy_strings_string_eastern_counter_accept_03	Твоя думка дуже вдала. Ручаюся, що вона сподобається моєму повелителю.	true
diplomacy_strings_string_eastern_counter_reject_03	Ти говориш відкрито і чесно, проте твоя пропозиція не порадує мого повелителя.	true
diplomacy_strings_string_eastern_counter_accept_02	Вітаю, ти маєш чудовий дар красномовства! Мій пан схвалить нашу угоду.	true
diplomacy_strings_string_eastern_counter_reject_02	Ти гідно представляєш інтереси свого народу, але твої слова не знайшли відгуку в моєму серці.	true
diplomacy_strings_string_eastern_counter_accept_01	Так, твоя пропозиція доречна... Мені вона здається вигідною; сподіваюся, що мій володар теж так вирішить.	true
diplomacy_strings_string_eastern_counter_reject_01	Не сумніваюся, що власні слова здаються тобі золотими, але мені вони здаються витканими з пилу!	true
diplomacy_strings_string_eastern_counter_accept_06	Твої умови нам підходять! Смію зауважити, однак, що твої таланти марнуються даремно. Тобі слід продавати старих верблюдів!	true
diplomacy_strings_string_eastern_counter_reject_06	Згода образить моїх богів - а твої будуть реготати!	true
diplomacy_strings_string_cha_personality_desc_short_isolationist	Вузький кругозір	true
diplomacy_strings_string_eastern_counter_accept_05	Навіть чужою мовою ти торгуєшся так само добре... як я! Таким людям ми завжди раді.	true
diplomacy_strings_string_eastern_counter_reject_05	Твоя спритність зробила б честь каппадокійській торговці фігами! І - ні, я не можу погодитися.	true
diplomacy_strings_string_eastern_counter_accept_04	Славно. Боги будуть задоволені і благословлять нашу угоду.	true
diplomacy_strings_string_eastern_counter_reject_04	Я зроблю своєму народу погану послугу, якщо погоджуся на ці грабіжницькі умови!	true
diplomacy_strings_string_barb_christian_approach_demanding_01	Я посланий говорити з тобою і слухати тебе. Мабуть, я розгнівав Господа, якщо така його воля.	true
diplomacy_strings_string_barb_christian_approach_demanding_02	Я прийшов говорити. Ха! За які ж гріхи мені дісталась ця бабська робота?	true
diplomacy_strings_string_barbarian_request_military_access_01	Війна змушує мене просити про дружню послугу. Дозволь моєму війську пройти через твої володіння!	true
diplomacy_strings_string_barbarian_request_military_access_02	Листя летить за вітром туди, куди накажуть духи. Чи пропустиш ти моїх воїнів, що йдуть, наче листя, гнане вітром?	true
diplomacy_strings_string_barbarian_request_military_access_03	Наші воїни ходять будь-якими шляхами, але не стануть зневажати твою честь. Тому я прошу дозволу увійти на твої землі.	true
diplomacy_strings_string_rome_christian_accept_requesting_04	Нехай буде так! Відтепер ми будемо шанувати цей договір!	true
diplomacy_strings_string_rome_christian_accept_requesting_05	Ці умови для нас прийнятні. Від імені Імператора я даю згоду.	true
diplomacy_strings_string_rome_christian_accept_requesting_06	Час обговорити умови, а потім я повернуся до Імператора з усвідомленням добре виконаної роботи.	true
diplomacy_strings_string_diplomatic_option_third_party_join_war	Вступити у війну...	true
diplomacy_strings_string_rome_christian_greek_reject_angry_defend_against_faction_01	Воістину, збирається буря. Це твоя турбота, адже саме твій народ розгнівав Вседержителя.	true
diplomacy_strings_string_offer_or_demand_break_military_alliance	Розірвати військовий союз:	true
diplomacy_strings_string_barbarian_acknowledge_get_military_off_my_land_01	Моє військо відійде. Сподіваюся, одного разу ти зрозумієш всю дурість свого рішення!	true
diplomacy_strings_string_barbarian_acknowledge_get_military_off_my_land_03	Як забажаєш. Ми залишимо твої землі. Шкода, твоїм воїнам не завадило б ще повчитися...	true
diplomacy_strings_string_barbarian_acknowledge_get_military_off_my_land_02	Ми покинемо твої землі. Тепер самі захищайтеся і самі втішайте своїх жінок.	true
diplomacy_strings_string_barb_christian_generic_reject_respectful_08	Бог розгнівається, якщо я так легко погоджуся. Але язиком трясти ти майстер!	true
diplomacy_strings_string_barb_christian_generic_reject_respectful_02	Господь велить мені відхилити твою пропозицію, хоча вона здається вигідною, і чекати чогось кращого.	true
diplomacy_strings_string_rome_christian_greek_reject_angry_offer_single_payment_01	Господь дарував нам процвітання. Не намагайся втрутитися: ми не торгуємо священними скарбами!	true
diplomacy_strings_string_current_treaty_payments_paying	Виплата	true
diplomacy_strings_string_barbarian_not_interested_in_further_discussion_04	Досить! Від розмов моя голова розколюється, ніби туди набилися бджоли! Мені терміново треба випити.	true
diplomacy_strings_string_barbarian_not_interested_in_further_discussion_05	Ми говорили і говорили, поки самі боги не заснули. І все даремно. Все, закінчуємо, набридло.	true
diplomacy_strings_string_barbarian_not_interested_in_further_discussion_06	Ти обстрілюєш мене словами! Досить! Несіть брагу та печеню!	true
diplomacy_strings_string_barbarian_not_interested_in_further_discussion_01	Нескінченне базікання втомлює й більше личить жінкам. Твої слова наповнили вуха, але не зачепили серця.	true
diplomacy_strings_string_barbarian_not_interested_in_further_discussion_02	Випий вина, в ім'я всіх богів, і припини молоти язиком! Від твоїх слів у мене гуде макітра і плавляться мізки!	true
diplomacy_strings_string_barbarian_not_interested_in_further_discussion_03	Ти набридаєш мені розмовами, а я міг би насолоджуватися жіночим теплом і гарною випивкою!	true
diplomacy_strings_string_barb_christian_demand_get_military_off_my_land_01	Наші землі закриті для тебе, забери воїнів. Так велів Всевишній.	true
diplomacy_strings_string_eastern_request_angry_get_military_off_my_land_01	Виведи війська з нашої землі, поки боги не обернулися проти них, а мій народ не взяв у руки мечі!	true
diplomacy_strings_string_eastern_request_angry_get_military_off_my_land_03	Сама земля стогне під підошвами твоїх солдатів! Забери війська з наших кордонів!	true
diplomacy_strings_string_eastern_request_angry_get_military_off_my_land_02	Довго ми терпіли сморід твоїх військ, але всьому є межа. Забери війська з нашої землі!	true
diplomacy_strings_string_personality_desc_short_likes_northeners	Захоплюється балтами	true
diplomacy_strings_string_eastern_reject_offer_demand_peace_05	Твоє благання про мир втішило наш слух, але не торкнулося серця. Війна триватиме.	true
diplomacy_strings_string_eastern_reject_offer_demand_trade_02	Наші купці не бажають вести з тобою торгівлю, а мій пан і володар довіряє їхньому рішенню.	true
diplomacy_strings_string_personality_desc_long_rebellious	Цей лідер цінує незалежність. Будь-хто, хто спробує нав'язати йому свою волю, пошкодує про це.\\n\\n[[col:red]]- Великі штрафи до дип. відносин з державами, що надають заступництво.[[/col]]	true
diplomacy_strings_string_eastern_reject_offer_demand_peace_04	Ти заманюєш нас миром. Але навіщо нам блискуча дрібничка, якщо ми за крок від великого багатства - переможної слави?	true
diplomacy_strings_string_eastern_reject_offer_demand_trade_03	З великим жалем скажу, що ми не можемо вести з тобою торгівлю. Наші купці ведуть справи з іншими землями.	true
diplomacy_strings_string_eastern_reject_offer_demand_peace_06	Воістину, було пролито багато крові. Тепер ти просиш про мир, але ми все ж віддамо перевагу крові.	true
diplomacy_strings_string_eastern_reject_offer_demand_trade_01	Боги велять нам бути великодушними, а тому ми не будемо наживатися за ваш рахунок.	true
diplomacy_strings_string_eastern_reject_offer_demand_peace_01	Ніхто не забороняє тобі мріяти про мир: я ж мрію про небалакучу тещу.	true
diplomacy_strings_string_offer_or_demand_marriage	text_rejected	true
diplomacy_strings_string_eastern_reject_offer_demand_peace_03	Боги наділили тебе розумом. На твою біду, вони не дали нам великодушності.	true
diplomacy_strings_string_eastern_reject_offer_demand_peace_02	Вражаюча нахабність! Твій мирний договір - лише гарна обгортка без змісту. Тут на таке ніхто не купиться.	true
diplomacy_strings_string_barb_christian_accept_demanding_06	Такі принизливі умови не до вподоби Господу. Але в мене немає іншого вибору.	true
diplomacy_strings_string_barb_christian_accept_demanding_01	Господь свідок: моя честь не заплямована, я приймаю цю пропозицію лише в ім'я свого народу!	true
diplomacy_strings_string_barb_christian_accept_demanding_02	Від імені свого народу я даю згоду. Якщо мій вибір поганий, нехай Господь вкаже мені на це.	true
diplomacy_strings_string_current_treaty_at_war	Війна ||Ви перебуваєте у стані війни з цією фракцією.	true
