key	text	tooltip
diplomacy_strings_string_barb_hun_offer_beg_peace_01	Нашим богам огидне це кровопролиття! Ми просимо закінчити війну між нашими народами.	true
diplomacy_strings_string_barb_hun_offer_beg_peace_02	Мій народ просить прийти до згоди, яка покладе край ворожнечі.	true
diplomacy_strings_string_barb_hun_offer_beg_peace_03	Тільки темним богам до вподоби ця війна і наші страждання. Ми просимо тебе про мир.	true
diplomacy_strings_string_personality_desc_short_defensive	Обережний	true
diplomacy_strings_string_rome_christian_greek_generic_reject_respectful_02	Це неможливо. Прийми таку пропозицію, і нагородою мені стануть презирство народу і гнів Господній.	true
diplomacy_strings_string_rome_christian_greek_generic_reject_respectful_04	Господь благословив тебе вмінням добре говорити. Мене ж він наділив майстерністю добре слухати, а якщо потрібно - відповідати відмовою.	true
diplomacy_strings_string_diplomatic_factor_trespassing	Перехід кордонів держави	true
diplomacy_strings_string_barbarian_offer_beg_cooperation_06	Боги спілкуються з нами через грім і блискавку, але їх воля ясна. Ми повинні укласти з тобою союз, якщо ти не проти.	true
diplomacy_strings_string_barbarian_offer_beg_cooperation_04	Один у полі не воїн! Хіба нам не судилося стати побратимами по зброї і прикривати один одному спину?	true
diplomacy_strings_string_barbarian_offer_beg_cooperation_05	У густіючій темряві я прошу тебе: стань світлом мого народу. Я прошу про союз...	true
diplomacy_strings_string_barbarian_offer_beg_cooperation_02	Коли згущуються хмари, розумна людина знаходить притулок під дахом друга. Сподіваюся, ви укриєте нас від бурі.	true
diplomacy_strings_string_barbarian_offer_beg_cooperation_03	Духи предків сказали, що ви станете нашими вірними друзями. Ми не можемо їм перечити!	true
diplomacy_strings_string_barbarian_offer_beg_cooperation_01	За тобою - сила, честь і гідність. Тільки дурень не захоче мати твій народ у друзях.	true
diplomacy_strings_string_barbarian_generic_reject_09	Боги цього не допустять! Прийнявши твою пропозицію, я накличу на себе божественний і народний гнів. Я не стану так ризикувати.	true
diplomacy_strings_string_barbarian_generic_reject_08	У твоїх словах багато хорошого... багато, але не достатньо!	true
diplomacy_strings_string_rome_christian_receive_demanding_08	Що ж, говори. Я передам твою пропозицію Імператору, але прошу: не затримуй мене.	true
diplomacy_strings_string_barb_hun_reject_defend_against_faction_02	Не буду давати порожніх обіцянок. Ні, ми не зможемо тобі допомогти. Сподівайся тільки на себе.	true
diplomacy_strings_string_barb_hun_war_declaration_10	Ми прийдемо за тобою глухої ночі і не залишимо в живих нікого. Жодної душі. Так ми ведемо війну.	true
diplomacy_strings_string_barbarian_generic_reject_01	Ні, ні, ні! Якщо я підпишуся на таке, боги нашлють на нас мор!	true
diplomacy_strings_string_barb_hun_reject_defend_against_faction_03	Мій народ не біжить на поклик одного вовка: ми дивимося, що буде робити решта зграї.	true
diplomacy_strings_string_barbarian_generic_reject_03	Мій народ заслужив набагато більшої поваги. Хіба ми не воїни, не чоловіки?	true
diplomacy_strings_string_barb_hun_reject_defend_against_faction_01	Твій план хороший, але ми не можемо надіслати тобі підкріплення. Предки проти цього.	true
diplomacy_strings_string_barbarian_generic_reject_02	Мій народ такого не пробачить, а боги покарають мене - і будуть праві!	true
diplomacy_strings_string_barbarian_generic_reject_05	На жаль, на жаль! Твоя пропозиція не обіцяє моєму народу нічого хорошого.	true
diplomacy_strings_string_barbarian_generic_reject_04	Ні, я не посмію зв'язати свій народ таким договором, бо втрачу його довіру.	true
diplomacy_strings_string_personality_desc_long_likes_sassanids	Він упевнений в непогрішності тюрків.	true
diplomacy_strings_string_barbarian_generic_reject_07	Мало. Я не можу озвучити такі умови перед народом. Нам потрібно більше!	true
diplomacy_strings_string_rome_christian_receive_demanding_03	Вітаю тебе від імені Імператора і так далі. Говори, чого тобі потрібно?	true
diplomacy_strings_string_barbarian_generic_reject_06	Це неможливо! Мій народ чекає від мене більшого.	true
diplomacy_strings_string_barb_christian_demand_player_join_confederation_02	Ми ж однієї крові! Навіщо заперечувати, що ми одна сім'я?	true
diplomacy_strings_string_barbarian_receive_begging_10	Так, поговорити потрібно. Для цієї справи потрібна хороша закуска, гарячий вогонь і гарячі дівчата!	true
diplomacy_strings_string_mk_personality_desc_short_likes_arabs	Захоплюється арабами	true
diplomacy_strings_string_diplomatic_option_hard_access	Право проходу	true
diplomacy_strings_string_personality_desc_long_opportunist_expansionist	Варто залишити ворота відкритими, як ця людина надішле туди армію своїх головорізів.	true
diplomacy_strings_string_diplomatic_option_third_party_join_war_on_table_tooltip_ai_side	У разі успіху сторона, з якою ви ведете переговори, вступить у війну з перерахованими фракціями.	true
diplomacy_strings_string_barb_hun_acknowledge_war_03	Моє військо виступить сьогодні ж, а наші жінки почнуть готувати переможний бенкет.	true
diplomacy_strings_string_barb_hun_acknowledge_war_02	Ну що ж, нехай блищать мечі! Нас чекає слава!	true
diplomacy_strings_string_barb_hun_acknowledge_war_01	Хай буде війна! Краще гострий меч, ніж брехливий язик!	true
diplomacy_strings_string_barb_hun_acknowledge_war_07	Отже, ми йдемо в похід! Готуйте душі, скоро вони відправляться до праотців...	true
diplomacy_strings_string_barb_hun_acknowledge_war_06	Боги свідки, ми славно повоюємо! Трубіть у ріг! Гостріть мечі! А ти молись своїм підлим богам...	true
diplomacy_strings_string_barb_hun_acknowledge_war_05	Чудово! Наші воїни змучилися без діла. Нехай повеселяться, розрізаючи ваші горлянки.	true
diplomacy_strings_string_rome_christian_reject_angry_offer_demand_peace_04	Хочеш покласти край війні? Імператор не здивується. Нам добре відомо, що при слові «війна» у тебе тремтять коліна.	true
diplomacy_strings_string_barb_christian_too_many_counters_01	Досить! Досить! Сам Господь втомився слухати твої жалюгідні лепетання! Душа просить браги, а не хитромудрої балаканини!	true
diplomacy_strings_string_barb_hun_acknowledge_war_04	Наші юнаки мріють стати воїнами! Ваша кров змиє з них сліди дитинства!	true
diplomacy_strings_string_rome_christian_reject_angry_offer_demand_trade_02	Розумію, що ви полюбляєте торгуватися, мов жінки за в’язку цибулі чи риби. Але Імператору не до того — він керує величезною державою!	true
diplomacy_strings_string_barbarian_request_single_payment_02	Духи обурюються тим, що наша скарбниця порожня. Допоможи нам у цій біді!	true
diplomacy_strings_string_barbarian_request_single_payment_03	Запорука дружби, наприклад, скромний дар золотом, принесе тобі прихильність всього нашого народу.	true
diplomacy_strings_string_barb_hun_acknowledge_war_09	Нехай ваші жони назавжди прощаються зі своїми чоловіками: скоро я насаджу їхні голови на держаки наших знамен!	true
diplomacy_strings_string_barb_hun_acknowledge_war_08	Війна! Ах, яке чудове слово! Наші воїни заберуть ваші голови...	true
diplomacy_strings_string_barbarian_request_single_payment_01	Надішліть нам трохи золота! У тебе його хоч відбавляй, і мій народ не хоче стати жертвою згубної заздрості!	true
diplomacy_strings_string_barb_hun_demand_defend_against_faction_02	Коли згущуються хмари, ми шукаємо допомоги і притулку. Сьогодні ваша черга прийти на допомогу...	true
diplomacy_strings_string_barb_hun_demand_defend_against_faction_03	Боги випробовують нас війною! Встаньте ж на наш захист!	true
diplomacy_strings_string_barb_hun_demand_defend_against_faction_01	Нам потрібна твоя допомога у війні з цим народом. Така ціна братерства!	true
diplomacy_strings_string_barbarian_acknowledge_cancel_cooperation_03	Значить, тут наші шляхи розходяться. Тепер вороги оточать вас, як зграя шакалів!	true
diplomacy_strings_string_barbarian_acknowledge_cancel_cooperation_02	Важко знайти заміну мужності і силі друзів... але я поважаю твоє рішення.	true
diplomacy_strings_string_barbarian_acknowledge_cancel_cooperation_01	Хай буде так. Ми самі влаштуємо полювання і самі зберемо трофеї!	true
diplomacy_strings_string_diplomatic_option_client_state_warning	Відмовитися від статусу васала||Ви хочете розірвати договір про статус держави-васала з цією фракцією?	true
diplomacy_strings_string_barbarian_acknowledge_cancel_cooperation_06	Я буду молити богів, щоб відтепер вони берегли і захищали тебе!	true
diplomacy_strings_string_barbarian_acknowledge_cancel_cooperation_05	Я поважаю твоє прохання, проте пам'ятай: мій народ - могутні воїни, а вороги вже точать на тебе мечі...	true
diplomacy_strings_string_barbarian_acknowledge_cancel_cooperation_04	Що ж, прощавай, брате! Будемо сподіватися, що наші шляхи знову перетнуться.	true
diplomacy_strings_string_current_treaty_giving_soft_military_access_turns	Договір про право проходу||Отримавши право проходу, ви можете перетинати кордони іншої фракції без негативних дипломатичних наслідків.	true
diplomacy_strings_string_aggressiveness_very_high	Агресивний	true
diplomacy_strings_string_barbarian_receive_begging_08	Для тебе вже засмажений цілий вепр і відкорковані бочки з найкращою брагою... але спершу давай поговоримо.	true
diplomacy_strings_string_barbarian_receive_begging_09	Мені кортить почути твої мудрі слова, але спершу дозволь піднести тобі вина.	true
diplomacy_strings_string_barbarian_receive_begging_04	Яка честь! На нас чекає така гора їжі, що можна нагодувати пару армій, але це потім. Спершу треба поговорити.	true
diplomacy_strings_string_barbarian_receive_begging_05	Мир тобі! Спершу поговоримо, а потім будемо бенкетувати, поки спина і черево не застогнуть від натуги!	true
diplomacy_strings_string_barbarian_receive_begging_06	Мир тобі, о друже мій! Духи цих місць вітають тебе, а боги благословляють!	true
diplomacy_strings_string_barbarian_receive_begging_07	Мій гідний друже, ти робиш нам честь. Ну, говори голосніше, щоб чули духи предків!	true
diplomacy_strings_string_barbarian_receive_begging_01	Присядь, мій друже, поговоримо... поки добре вино не позбавило нас дару мови.	true
diplomacy_strings_string_barbarian_receive_begging_02	Привіт, друже мій! Я велю подати медовухи, щоб втамувати спрагу, і жінок, щоб втамувати спрагу іншого роду!	true
diplomacy_strings_string_barbarian_receive_begging_03	Ласкаво просимо, дорогий друже! Розламай зі мною хліб і розділи вино, перш ніж промовити слово.	true
diplomacy_strings_string_barbarian_offer_regular_payment_02	Доблесть твоїх воїнів заслуговує нагороду! Ми обдаруємо частиною нашої військової здобичі.	true
diplomacy_strings_string_barbarian_offer_regular_payment_03	На батьківщині я не славлюся зразком щедрості і неохоче розлучаюся із золотом.	true
diplomacy_strings_string_barbarian_offer_regular_payment_01	Мені не подобається ця затія... Однак ми дамо вам золото. Багато золота!	true
diplomacy_strings_string_diplomatic_option_soft_access_warning	Позбавити права проходу||Ви хочете розірвати договір військового доступу з цією фракцією?	true
diplomacy_strings_string_personality_desc_short_dislikes_franks	Не любить франків	true
diplomacy_strings_string_personality_desc_short_dislikes_celts	Не любить західних кельтів	true
diplomacy_strings_string_barb_hun_acknowledge_war_10	Насувається буря, якої ніколи не бачило твоє плем'я. Рятуйтеся, шукайте укриття!	true
diplomacy_strings_string_barb_hun_request_regular_payment_01	Наш народ голодує, а ваші запаси великі. Як можна не допомогти сусідові в скрутну годину?	true
diplomacy_strings_string_barb_hun_request_regular_payment_02	Моє прохання просте: надішліть трохи золота моєму народу!	true
diplomacy_strings_string_barb_hun_request_regular_payment_03	Мої предки були дбайливими господарями. Продовжуючи добру традицію, я попрошу у тебе трохи золота.	true
diplomacy_strings_string_rome_beg_single_payment_01	Мій шляхетний друже, не вважай за клопіт перерахувати невелику суму золота до нашої скарбниці.	true
diplomacy_strings_string_rome_beg_single_payment_03	Ненавиджу просити, але цього разу нам дійсно потрібні гроші. Виручиш старих друзів?	true
diplomacy_strings_string_rome_christian_reject_angry_demand_client_status_02	Врятуй нас, Ісусе! Ти що, вважаєш нас безмозкими простолюдинами?	true
diplomacy_strings_string_rome_beg_single_payment_02	Наша скарбниця тимчасово спорожніла. Можливо, ти захочеш її трохи поповнити...	true
diplomacy_strings_string_personality_desc_short_dislikes_lombards	Не любить ломбардів	true
diplomacy_strings_string_rome_christian_receive_requesting_09	Від імені Імператора - ласкаво просимо! Я вітаю тебе і прошу поділитися з нами мудрістю.	true
diplomacy_strings_string_rome_christian_receive_requesting_03	Імператор доручив мені привітати і вислухати тебе.	true
diplomacy_strings_string_rome_christian_receive_requesting_02	Вітаю тебе від імені Імператора. Друг ти нам чи ворог, говори чесно - і отримаєш чесну відповідь.	true
diplomacy_strings_string_rome_christian_receive_requesting_01	Вітаю тебе і бажаю всього найкращого тобі і твоєму роду від імені Імператора. Про що ти хочеш говорити?	true
diplomacy_strings_string_rome_christian_receive_requesting_05	Мир тобі! Говори, бо через мене ти надсилаєш свої крилаті промови самому Імператору.	true
diplomacy_strings_string_rome_christian_receive_requesting_04	Сердечний привіт від Імператора! Сьогодні я буду говорити і слухати як їх уповноважений представник.	true
diplomacy_strings_string_personality_desc_short_dislikes_western_romans	Не любить європейців	true
diplomacy_strings_string_rome_christian_greek_reject_angry_demand_military_access_01	Ти що, приймаєш мене за тупого простолюдина? Я не куплюся на твої брехливі обіцянки!	true
diplomacy_strings_string_current_treaty_embargoing_trade	[Placeholder - Used by code only]	true
diplomacy_strings_string_rome_offer_request_peace_03	Обидва наші народи змучені війною, але вона нікому не дала переваги. Пора зупинити вбивства.	true
diplomacy_strings_string_rome_offer_request_peace_02	Ми втомилися від цієї війни; до того ж, у наших солдатів є й інші справи. Ми хочемо укласти мир.	true
diplomacy_strings_string_offer_or_demand_single_payment	Виплати	true
diplomacy_strings_string_rome_offer_request_peace_01	Ми не бачимо сенсу в подальшому кровопролитті і пропонуємо вам знайти спосіб гідно завершити війну.	true
diplomacy_strings_string_rome_offer_request_peace_06	Ми хочемо покласти край цьому жорстокому і безглуздому конфлікту. На яких умовах ти укладеш мир?	true
diplomacy_strings_string_rome_offer_request_trade_01	Ніхто не залишиться в збитку, якщо ти дозволиш нашим купцям торгувати на своїх землях. Ну ж, погоджуйся!	true
diplomacy_strings_string_rome_offer_request_peace_05	Наше протистояння засмучує богів. Який сенс і далі проливати кров? Що думаєш щодо мирного договору?	true
diplomacy_strings_string_rome_offer_request_trade_02	Якість наших товарів приємно порадує твій народ, а торгівля збагатить усіх. Що скажеш?	true
diplomacy_strings_string_rome_offer_request_peace_04	Війна не пішла на користь нікому з нас. Укласти мир було б наймудрішим рішенням.	true
diplomacy_strings_string_rome_offer_request_trade_03	Воістину, небеса благословлять наші землі, якщо між ними потягнуться купецькі каравани! Як ти вважаєш?	true
diplomacy_strings_string_diplomatic_option_cancel_soft_military_access	Позбавити права проходу	true
diplomacy_strings_string_eastern_beg_third_party_attack_03	Заклинаю тебе: яви свою міць! Зійдися з цими супостатами на полі бою, наповни страхом їхні серця!	true
diplomacy_strings_string_eastern_beg_third_party_attack_02	Цих зухвалих дурнів слід вгамувати. Чи зможе твоє славне військо з ними битися?	true
diplomacy_strings_string_diplomatic_option_third_party_break_military_alliance	Розірвати військовий союз...	true
diplomacy_strings_string_eastern_beg_third_party_attack_01	Люті звірі поки дрімають, але коли прокинуться — кинуться на нас обох. Удар же першим, поки вони вразливі!	true
diplomacy_strings_string_rome_christian_reject_offer_demand_cooperation_06	Нам вистачає власних сил. Тому ми відхиляємо твою пропозицію, проте Імператор запам'ятає твою доброту.	true
diplomacy_strings_string_rome_christian_reject_offer_demand_cooperation_05	Імператор не схвалить такої близькості між нашими державами. Ми відкинемо тебе і залишимося незайманими.	true
diplomacy_strings_string_rome_christian_reject_offer_demand_cooperation_04	Дякую, але зараз Імператор не потребує захисників. За ним стоїть уся міць нашої імперії!	true
diplomacy_strings_string_rome_christian_reject_offer_demand_cooperation_03	Твій хитрий народ придумав хитрий план, однак Імператор його не схвалить. Тому моя відповідь - ні.	true
diplomacy_strings_string_rome_christian_reject_offer_demand_cooperation_02	Імператор має достатньо ровів і укріплень, щоб не ховатися за чужими спинами.	true
diplomacy_strings_string_diplomatic_option_declare_war_tooltip	Оголошуючи війну фракції, ви розриваєте всі угоди, які ви уклали з нею раніше. Це може призвести і до того, що союзники вашого нового ворога також відвернуться від вас.	true
diplomacy_strings_string_cha_personality_desc_short_hedonist_diplomatic	Гедоніст	true
diplomacy_strings_string_eastern_demand_player_must_become_vassal_02	Відтепер твій народ повинен підкорятися моєму володареві. Чи будеш ти сперечатися з його волею?	true
diplomacy_strings_string_eastern_demand_player_must_become_vassal_03	Вибір за тобою: служи моєму панові, зберігши життя і частково честь, - або помри!	true
diplomacy_strings_string_eastern_demand_player_must_become_vassal_01	Прояви розсудливість. Прийми волю богів: незалежності твого народу настав кінець. Схилися перед моїм паном!	true
diplomacy_strings_string_personality_desc_short_empire_supporter	Захоплюється сильними імперіями	true
diplomacy_strings_string_diplomatic_option_vassal_tooltip	Запропонуйте іншій фракції стати вашою маріонетковою державою. Якщо ви достатньо сильні і отримаєте згоду, дана фракція перейде під ваш захист. При цьому вона майже повністю втратить політичну свободу і буде в усьому залежати від вас.	true
