key	text	tooltip
#Loc;1;text/db/diplomacy_strings.loc		
diplomacy_strings_string_barb_hun_offer_request_peace_01	Я слухав голоси предків. Вони говорять лише про мир...	true
diplomacy_strings_string_barb_hun_offer_request_peace_03	Суперники злетілися, як стерв'ятники, і годуються нашою ворожнечею. Час сховати мечі в піхви!	true
diplomacy_strings_string_barb_hun_offer_request_peace_02	І живі, і мертві проявили силу і мужність. Час укласти перемир'я...	true
diplomacy_strings_string_barb_hun_offer_request_peace_05	Скільки ще буде пролито крові, перш ніж ми схаменемося?	true
diplomacy_strings_string_barb_hun_offer_request_trade_02	Якщо ми почнемо торгувати, виграють обидві сторони. Що скажеш?	true
diplomacy_strings_string_barb_hun_offer_request_peace_04	Наші боги вважають цю війну безглуздою. Чи не час укласти мир?	true
diplomacy_strings_string_barb_hun_offer_request_trade_03	Наш товар ходовий, та й ваш у господарстві згодиться. Ви хочете з нами торгувати?	true
diplomacy_strings_string_barb_hun_offer_request_peace_06	Ви збираєтеся битися, поки обидва наші народи не впадуть на коліна від втоми?	true
diplomacy_strings_string_barb_hun_offer_request_trade_01	Потік золота і товарів збагачує обидва береги. Ти хочеш торгувати з нами?	true
diplomacy_strings_string_eastern_acknowledge_cancel_military_access_03	Відтепер і надалі наше військо обиратиме інші шляхи.	true
diplomacy_strings_string_eastern_acknowledge_cancel_military_access_02	Мій благородний володар закличе до ноги своїх псів війни.	true
diplomacy_strings_string_eastern_acknowledge_cancel_military_access_01	Прикро! Однак не буду сперечатися. Наші воїни надалі не перетинатимуть твоїх кордонів.	true
diplomacy_strings_string_rome_christian_cancel_military_access_01	Наші кордони закриті для твоїх воїнів. Імператор втрачає сон, коли по наших землях ходять чужі війська.	true
diplomacy_strings_string_barb_christian_generic_reject_08	У твоїх словах багато хорошого... багато, але не достатньо!	true
diplomacy_strings_string_barb_christian_generic_reject_09	Господь цього не допустить! Прийнявши твою пропозицію, я прогніваю і Бога, і народ. Я не стану так ризикувати.	true
diplomacy_strings_string_barb_christian_generic_reject_02	Мій народ такого не пробачить, а мій Бог покарає мене - і буде правий!	true
diplomacy_strings_string_barb_christian_generic_reject_01	Ні, ні, ні! Якщо я підпишуся на таке, Всемогутній нас покарає!	true
diplomacy_strings_string_barb_christian_reject_demand_single_payment_02	Господь розгнівається, якщо я куплю твою честь за презренний метал.	true
diplomacy_strings_string_rome_reject_attack_faction_01	Здійснити напад було б розумно, але, боюся, консули не дадуть на це військ.	true
diplomacy_strings_string_rome_reject_attack_faction_03	Наші легіони виконують накази. На твоє нещастя, їм не наказано підкорятися тобі.	true
diplomacy_strings_string_rome_reject_attack_faction_02	Ми не вважаємо за потрібне ризикувати людьми і грошима заради сумнівних підприємств на кшталт цього.	true
diplomacy_strings_string_barbarian_reject_angry_demand_single_payment_01	Ти хочеш золота? Я влаштую тобі золотий дощ з сечі моїх рабів... та й тієї мені для тебе шкода!	true
diplomacy_strings_string_barbarian_reject_angry_demand_single_payment_02	Нехай слабкі тілом і духом кидають тобі подачки. Я не стану підгодовувати приблудних псів!	true
diplomacy_strings_string_barbarian_reject_angry_demand_single_payment_03	Думаєш, у мене немає мізків? Або у мого народу? Або у моїх предків? Якщо я дам тобі хоч монету, ти будеш вічно тягнути з нас гроші!	true
diplomacy_strings_string_diplomatic_option_nonaggression_pact_warning	Розірвати договір про ненапад||Ви хочете розірвати договір про ненапад з цією фракцією?	true
diplomacy_strings_string_current_treaty_peace	Мирний договір	true
diplomacy_strings_string_personality_desc_short_dislikes_huns	Не любить кочівників	true
diplomacy_strings_string_rome_acknowledge_war_09	Досить балаканини. Тепер заговорять мечі!	true
diplomacy_strings_string_rome_acknowledge_war_08	Боги кинули жереб - нехай буде війна! Ми захистимо свою честь!	true
diplomacy_strings_string_rome_acknowledge_war_01	Ну що ж, боги вже одягають обладунки, щоб стати на захист нашої честі. Подбай про свої похорони!	true
diplomacy_strings_string_rome_acknowledge_war_03	Ви оголошуєте нам війну? Ха! Моліться своєму богу мертвих, бо скоро ви з ним зустрінетеся!	true
diplomacy_strings_string_rome_acknowledge_war_02	Рим обирає війну! Ми піднесемо молитви про перемогу, а ви готуйтеся до неминучої поразки!	true
diplomacy_strings_string_rome_acknowledge_war_05	Війна для Риму - шлях добре знаний. Ми не злякаємося і не відступимо.	true
diplomacy_strings_string_rome_acknowledge_war_04	Хай буде так. Ніщо так не розпалює римське серце, як близькість війни і можливість пролити ворожу кров!	true
diplomacy_strings_string_rome_acknowledge_war_07	Хай буде так! Краще відразу віддай мечу дружину і дітей, щоб врятувати їх від рабства!	true
diplomacy_strings_string_rome_acknowledge_war_06	Римські легіони приймають виклик! Коли попереду немає славних битв, мужі впадають у зневіру.	true
diplomacy_strings_string_barbarian_beg_third_party_join_war_03	Я не розумію, чому ти, при всій своїй мудрості і силі, зволікаєш вступити у війну. Я благаю тебе: бийся!	true
diplomacy_strings_string_barbarian_beg_third_party_join_war_02	Прошу, допоможи нам на полі бою! Твої воїни наведуть жах на будь-якого ворога.	true
diplomacy_strings_string_barbarian_beg_third_party_join_war_01	Додай свою грізну силу до нашої в цій нелегкій боротьбі! Я прошу заради свого народу.	true
diplomacy_strings_string_diplomatic_factor_broken_treaties	Розірвані договори з	true
diplomacy_strings_string_barb_hun_offer_demand_peace_05	Чи будемо ми рубати один одного, поки вороги не наситяться плоттю наших героїв? Або укладемо мир?	true
diplomacy_strings_string_barb_hun_offer_demand_trade_02	Сьогодні мене хвилює торгівля. Вона може збагатити і вас, і нас.	true
diplomacy_strings_string_barb_hun_offer_demand_peace_04	Ми говоримо словами сили. Знайди ж у собі силу покінчити з війною і укласти мир!	true
diplomacy_strings_string_barb_hun_offer_demand_trade_03	Моя пропозиція пряма, немов політ стріли. Наш народ хоче торгувати з вами. Що скажеш?	true
diplomacy_strings_string_barb_hun_offer_demand_peace_06	Ця війна шкодить нам обом. Я пропоную мир. Твоє слово?	true
diplomacy_strings_string_barb_hun_offer_demand_trade_01	Моя пропозиція нехитра: торгувати! Нам подобаються речі твого народу. Що скажеш?	true
diplomacy_strings_string_barb_hun_offer_demand_peace_01	Навіть великим воїнам інколи доводиться ховати мечі в піхви і вести переговори заради блага всього народу.	true
diplomacy_strings_string_barb_hun_offer_demand_peace_03	Наші мечі в крові, але я кажу: закінчимо війну. Сьогодні я пропоную тобі мир, але завтра запропоную тільки смерть.	true
diplomacy_strings_string_barb_hun_offer_demand_peace_02	Тільки великі здатні запропонувати ворогу перемир'я. Тільки слабкі прагнуть до загальної загибелі!	true
diplomacy_strings_string_current_treaty_payments_receiving	Отримання грошей	true
diplomacy_strings_string_rome_christian_demand_military_access_01	Стережися! Тільки божевільний стане на шляху римських легіонів!	true
diplomacy_strings_string_rome_christian_demand_military_access_03	Ну ж, прояви розсудливість. Імператор переконаний, що наші воїни мають право ходити по будь-яких землях.	true
diplomacy_strings_string_rome_christian_demand_military_access_02	Імператор спонукає тебе зробити добру справу і відкрити кордони римським легіонам.	true
diplomacy_strings_string_barb_hun_beg_get_military_off_my_land_03	Мої спочилі предки скаржаться на сон: твоє військо розбудило їх. Чому б йому не піти в інші землі?	true
diplomacy_strings_string_barb_hun_beg_get_military_off_my_land_02	Через ваших воїнів боги розгніваються і нашлють на нас неврожай! Нехай армія піде!	true
diplomacy_strings_string_barb_hun_beg_get_military_off_my_land_01	Луки, пагорби і долини стогнуть від поводів ваших воїнів. Вони повинні негайно покинути наші землі!	true
diplomacy_strings_string_barbarian_too_many_counters_04	Наші розмови довго блукали від порога до вогнища і назад. Пора зупинитися.	true
diplomacy_strings_string_barbarian_too_many_counters_06	Твоя думка блукає околицями, і, слідуючи за нею, я зовсім заплутуюсь. Досить з мене цих мудрованих балачок!	true
diplomacy_strings_string_barbarian_too_many_counters_01	Досить! Досить! Самі боги втомилися слухати твоє бекання! Душа просить браги, а не хитромудрої балаканини!	true
diplomacy_strings_string_rome_request_regular_payment_02	Ну ж бо, розщедрись! Дай орлу трохи поклювати!	true
diplomacy_strings_string_rome_request_regular_payment_03	Кажуть, деякі з наших шанованих людей прихильні до розкоші. Вони люблять і цінують тих, хто допомагає їм оплачувати цю розкіш.	true
diplomacy_strings_string_barbarian_too_many_counters_03	У твоїй голові якась словесна брага. Сказано багато - і нічого. На сьогодні з мене досить!	true
diplomacy_strings_string_barbarian_too_many_counters_02	Мабуть, навіть бог пліткарок вашого народу втомився слухати твої голосіння. Припини!	true
diplomacy_strings_string_rome_christian_greek_accept_begging_01	Ми не схильні літати в хмарах. Ми приймемо твою пропозицію, навіть якщо вона зачепить нашу гордість.	true
diplomacy_strings_string_rome_request_regular_payment_01	Зроби внесок у нашу скарбницю - відсотком стане наша дружба!	true
diplomacy_strings_string_diplomacy_treachery_warning_declare_war_no_duration	Оголошення війни за наявності угод або незабаром після їх розірвання розглядається як віроломний вчинок і засуджується всіма фракціями!	true
diplomacy_strings_string_relationship_very_friendly	Дуже дружні	true
diplomacy_strings_string_rome_acknowledge_war_10	Ось до чого все йшло! Ми даремно витрачали слова, але не витратимо багато часу на те, щоб знищити вас!	true
diplomacy_strings_string_barb_christian_reject_angry_defend_against_faction_03	Тобі вистачає хоробрості на подібні прохання, але ти не можеш підняти меч і захищатися? Господь Всемогутній!	true
diplomacy_strings_string_barb_hun_reject_offer_demand_peace_06	Нашим богам не подобається мир. Вони хочуть крові! І честі! І жертв! А ми лише слідуємо їх волі...	true
diplomacy_strings_string_barb_hun_reject_offer_demand_trade_01	Не думаю, що моїм людям потрібні твої дрібнички. Чесне військове спорядження нам набагато корисніше.	true
diplomacy_strings_string_barb_hun_reject_offer_demand_peace_04	Ми здогадувалися, що ти попросиш миру, - але не так скоро! Ні, мої воїни ще не наситилися славою...	true
diplomacy_strings_string_barb_hun_reject_offer_demand_trade_03	Нам невигідно торгувати з вашим народом.	true
diplomacy_strings_string_barb_hun_reject_offer_demand_peace_05	Зараз не час для миру. Коли місяць зміниться і знову прибуде, можливо, тоді...	true
diplomacy_strings_string_barb_hun_reject_offer_demand_trade_02	Твої товари знадобляться десь ще, але тільки не тут...	true
diplomacy_strings_string_barb_hun_reject_offer_demand_peace_02	Дивитися на нікчемне створіння, таке як ти, смішно, але слухати тебе ще смішніше.	true
diplomacy_strings_string_barb_hun_reject_offer_demand_peace_03	Час тиші ще не настав. Ми не готові укласти мир.	true
diplomacy_strings_string_barb_hun_reject_offer_demand_peace_01	А ти все жартуєш! У твого народу чудове почуття гумору.	true
diplomacy_strings_string_offer_or_demand_break_soft_military_access	Розірвати договір про право проходу:	true
diplomacy_strings_string_barb_hun_beg_third_party_break_treaty_01	Навіщо ти водишся з цими безрідними мерзотниками? Усі знають про їхню злобу й підступність!	true
diplomacy_strings_string_barb_hun_beg_third_party_break_treaty_03	Не сиди на прив'язі у цих віроломних лиходіїв! Твій народ заслуговує на краще ставлення. Кому як не тобі це знати!	true
diplomacy_strings_string_barb_hun_beg_third_party_break_treaty_02	Не плямуй себе дружбою з цими невдячними тварюками! Вони зрадять тебе!	true
diplomacy_strings_string_eastern_reject_angry_offer_demand_cooperation_06	Як ти смієш пропонувати нам договір?! Твій народ підлий і смердючий, як верблюжий послід під ногами! Тьху!	true
diplomacy_strings_string_eastern_reject_angry_offer_demand_cooperation_05	Твоя неприхована зухвалість обурлива. Обережніше з висловами, інакше моє обурення виллється у винахідливу жорстокість!	true
diplomacy_strings_string_eastern_reject_angry_offer_demand_cooperation_04	Ти приймаєш ввічливість за щиру турботу. Зрозумій: якщо весь твій народ вимре, я подякую богам.	true
diplomacy_strings_string_eastern_reject_angry_offer_demand_cooperation_03	Клянуся шерстю биків Мітри! Мені не зрозуміти твоїх збочених уявлень про те, що добре, а що погано!	true
diplomacy_strings_string_eastern_reject_angry_offer_demand_cooperation_02	Клянуся священним полум'ям, що не зганьблю свого доброго імені розвагами з прокаженою блудницею!	true
diplomacy_strings_string_eastern_reject_angry_offer_demand_cooperation_01	Наші полководці знімуть з мене шкіру і обтягнуть нею барабан, якщо я зв'яжу їх договором з твоїми ходячими мерцями!	true
diplomacy_strings_string_barb_hun_request_player_join_confederation_02	Час настав поєднати себе узами, міцнішими за дружбу!	true
diplomacy_strings_string_rome_war_declaration_02	Молись про легку смерть! Твоя дурість пробудила гнів наших могутніх воїнів!	true
diplomacy_strings_string_barb_hun_request_player_join_confederation_03	Нехай наші народи стануть єдиною родиною! Разом ми здобудемо незрівнянну славу!	true
diplomacy_strings_string_rome_war_declaration_03	Розмова закінчена. Ми будемо раді приєднати твої землі до своїх володінь!	true
diplomacy_strings_string_barb_hun_request_player_join_confederation_01	Якщо наші армії стануть під одним прапором, від їхніх вчинків здригнеться небо!	true
diplomacy_strings_string_rome_war_declaration_01	Хвала богам! Більше ніяких розмов! Нарешті ми зійдемося на полі бою, як личить справжнім воїнам!	true
diplomacy_strings_string_rome_war_declaration_06	Хай буде так. Ти кличеш бурю, і ми допоможемо нашим богам обрушити на тебе шквал!	true
diplomacy_strings_string_rome_war_declaration_07	Ви самі винні! Люди проклянуть твоє ім'я, коли річки стануть червоними від крові твого народу!	true
diplomacy_strings_string_rome_war_declaration_04	Ми будемо жадібно дивитися на повільне, болісне задушення твоїх полководців під час нашого тріумфу!	true
diplomacy_strings_string_personality_desc_cha_short_empire_supporter	Захоплюється сильними імперіями	true
diplomacy_strings_string_rome_war_declaration_05	Як увічнити твою поразку? Красивою аркою чи колоною? Плачем твоїх поневолених жінок?	true
diplomacy_strings_string_rome_war_declaration_08	Твоє рішення знищить тебе і твій народ, зробить дітей сиротами, а жінок - вдовами. Клянуся небесами, все так і буде!	true
diplomacy_strings_string_rome_war_declaration_09	Отже, ти обираєш меч. Не сумніваюся, твій народ скаже тобі спасибі, коли римські легіонери прийдуть по їхні душі.	true
diplomacy_strings_string_barb_christian_generic_offer_demand_04	Я пропоную чесну угоду. Господь свідок: все буде так, як ми сьогодні вирішимо.	true
diplomacy_strings_string_rome_offer_beg_peace_06	Нам нелегко просити про мир, але немає нічого ганебного в тому, щоб звернутися з проханням до гідного супротивника.	true
diplomacy_strings_string_rome_offer_beg_trade_01	У тебе відмінний товар, жителі наших міст охоче його розкуплять. Погодься, торгівля принесе користь нам усім.	true
diplomacy_strings_string_rome_offer_beg_peace_04	Ти можеш пишатися своїми воїнами! Чи готові твої посли діяти так само гідно й укласти достойний мир?	true
diplomacy_strings_string_rome_offer_beg_trade_03	Товари твоїх купців високо цінуються в усьому світі. Чому ти не посилаєш їх у наші землі?	true
diplomacy_strings_string_rome_offer_beg_peace_05	Твій народ виявився найчеснішим і найблагороднішим ворогом, якого ми знали. Ми бажаємо укласти з тобою мир!	true
diplomacy_strings_string_rome_offer_beg_trade_02	Нас дуже приваблюють твої товари. І твої, і мої співвітчизники тільки виграють, якщо ми відкриємо торговий шлях!	true
diplomacy_strings_string_rome_offer_beg_peace_02	Твої люди хоробро билися, але чи не настав час відкласти мечі вбік?	true
diplomacy_strings_string_rome_offer_beg_peace_03	Наші легіони і твої війська довго змагалися за військову славу. На думку сенату, настав час укласти мир.	true
diplomacy_strings_string_rome_offer_beg_peace_01	Ми просимо про мир. Що хорошого в цій війні?	true
diplomacy_strings_string_diplomatic_factor_friendly_towards_enemies_negative	Дружні дії щодо ворогів	true
diplomacy_strings_string_barbarian_reject_angry_offer_single_payment_03	Можливо, грошима ти завоюєш любов повій - але не мрій використовувати нас для збочених задоволень!	true
diplomacy_strings_string_barbarian_reject_angry_offer_single_payment_01	Дякуй богам, що я не змусив тебе проковтнути всі твої скарби. Ця пропозиція образлива!	true
diplomacy_strings_string_eastern_reject_angry_offer_regular_payment_03	Твоє золото все в бруді, а ми не хочемо бруднити руки.	true
diplomacy_strings_string_eastern_reject_angry_offer_regular_payment_02	Купуй на свої скарби рабів, тіш себе низькими задоволеннями. Ми ж непідкупні.	true
diplomacy_strings_string_eastern_reject_angry_offer_regular_payment_01	Наші торговці люблять золото, народ наш любить золото. Твоє ж золото не любить ніхто!	true
diplomacy_strings_string_barb_christian_offer_beg_cooperation_06	Всевишній говорить з нами мовою грому і блискавки, але його воля завжди ясна. Ми повинні укласти з тобою союз, якщо ти не проти...	true
diplomacy_strings_string_barb_christian_offer_beg_cooperation_03	Сам Спаситель сказав, що ви наші друзі. Хто ми такі, щоб порушувати волю Господа?	true
diplomacy_strings_string_rome_christian_reject_angry_defend_against_faction_03	Ні, наші легіони не призначені для такого. Вони борються тільки з волі Господа і Імператора!	true
